{
  "type": "x402-observation",
  "version": 0,
  "id": "obs_2026-10-25_004895",
  "observer": {
    "id": "did:web:vet402.com#obs-key-2026-09",
    "address": "0x6232335B5264f7aa62a51f8ACc4676D22511Ff3C",
    "sequence": 4895
  },
  "issuedAt": 1792994924,
  "verdict": {
    "code": "DELIVERED",
    "reason": "Payment settled; HTTP 200, non-empty body.",
    "recheck": null,
    "checks": {
      "paymentSettled": true,
      "httpStatus": 200,
      "bodyNonEmpty": true,
      "declaredFormatMatched": null,
      "sellerReceiptValid": null,
      "responseHashMatchesSeller": null
    }
  },
  "resourceUrl": "https://aws-bedrock.grok.me/api/v1/search",
  "payment": {
    "network": "solana:5eykt4UsFv8P8NJdTREpY1vzqKqZKvdp",
    "scheme": "x402-exact",
    "transaction": "4MkFUoJ65TWscouhuHgmBmyAx9YiwxXa1jS1CBjkTwcxeG9cHpe3THhGniZTQonsWzuejRWt7haYia7yUHCnPqCh",
    "payer": "9VaAPD1CPE4i8pquaRwE7LvZXMmvGdgffD4Q8xJgaQRu",
    "payTo": "8s2VtNV5E1C9XJbfk4WGpMTiSJVPLeB8wcuJYQS5MFQa",
    "asset": "EPjFWdd5AufqSSqeM2qN1xzybapC8G4wEGGkZwyTDt1v",
    "amount": "5000",
    "decimals": 6,
    "assetSymbol": "USDC",
    "settledAt": null
  },
  "request": {
    "method": "GET",
    "url_hash": "0x15aa070ba030b74d08ef3ce6eb55685d1df939443c58c583fac1e18c8d24f622",
    "params_hash": "0xbd5be801107d65ee92366d0bb61ea5b4d486a52c6b8549e0e74c2aca82fd5947",
    "params_salted": true,
    "ts": "2026-10-25T15:36:54.946Z"
  },
  "response": {
    "status": 200,
    "responseHash": null,
    "responseHashAlg": null,
    "responseHashEncoding": null,
    "responseHashNote": "hash not recorded (the daily remeasure run does not hash the response)",
    "contentType": null,
    "bytes": null,
    "receivedAt": null,
    "latencyMs": null
  },
  "offer": null,
  "sellerReceipt": null,
  "scope": {
    "proves": [
      "observer-signed-at-time",
      "payment-on-chain",
      "response-status-at-time",
      "existed-by-anchor-time"
    ],
    "doesNotProve": [
      "content-correctness",
      "seller-trustworthiness",
      "seller-availability-now",
      "refund-entitlement"
    ],
    "vantage": "Seen from vet402's network only.",
    "text": "Proves vet402 paid and what HTTP status came back at this time. Does not prove the content is correct."
  },
  "notRecorded": [
    "request.ts: the time recorded is when the spend was reserved, just before the paid request",
    "response.contentType",
    "response.bytes",
    "response.receivedAt",
    "response.latencyMs",
    "payment.settledAt",
    "declared output format (not checked in this run)",
    "response.responseHash: hash not recorded (the daily remeasure run does not hash the response)"
  ],
  "source": {
    "dataset": "remeasure-solana-2026-10-25",
    "row": "rows[176]"
  },
  "contact": "https://vet402.com/",
  "anchor": {
    "status": "anchored",
    "day": "2026-10-25",
    "network": "solana:5eykt4UsFv8P8NJdTREpY1vzqKqZKvdp",
    "tx": "AxL7Z35KB3Mw8tRbBgM5TP6oHnW1zRJkmdhci9tkbhU99Ne9x9q9JNPAQVnQJBcpLVMgzbvRx5rYWCC7sKYXNS7",
    "root": "0x1c3a8302f5fa14ff412fddcbfd5b30a13581a79eeefd83c7805447605eb1550e",
    "leafIndex": 107,
    "proof": [
      "0xc96e2cb1fbf9bfbc1f6f47322ab3ceba67b6686a718c56f9a36e4a838b82a6a1",
      "0xa60299267b65c22f246e8822f884781704a7c310fd66cbf34f466b150a16984a",
      "0x90a8977d27ebb7b701c8521d80c92526b866c8603fce2949bda8bba3f9ab1ea6",
      "0x2a2824772a2d444cbf89d4c0d2ca8c514cdbc5992a793a138a84c67fb9724ffb",
      "0x1b16b18e4bdb801b356c73e07178c3c1ff46bbe992fab2e8256a8eea572ef3a7",
      "0x208c81a986b0d65b038d5c8d76d034610c7801905f96ef4ccf70cbaa5427e63f",
      "0xc488b22432fb5927507096764a7622e10269195fa9a52ad53a0dd5bf1e9636d7",
      "0x060295a74352e141b1c330936a0219616e2ce2740cf390996f0b2976c620032e"
    ],
    "count": 149,
    "sequenceRange": [
      4788,
      4936
    ],
    "observerAddress": "0x6232335B5264f7aa62a51f8ACc4676D22511Ff3C",
    "anchoredAt": "2026-10-26T06:12:44.000Z"
  },
  "corrections": [],
  "signature": {
    "format": "eip712",
    "signature": "0xe7518ffe3e348884661a9dded4e24f045328a3117f2e51711bf7886af21d1ab907ce6ecb8764a36fba3ff5c35da4e56b1d41545c73d921c601c778e593b004d81c"
  }
}
