{
  "type": "x402-observation",
  "version": 0,
  "id": "obs_2026-09-28_000094",
  "observer": {
    "id": "did:web:vet402.com#obs-key-2026-09",
    "address": "0x6232335B5264f7aa62a51f8ACc4676D22511Ff3C",
    "sequence": 94
  },
  "issuedAt": 1790596527,
  "verdict": {
    "code": "DELIVERED",
    "reason": "Payment settled; HTTP 200, body size not recorded.",
    "recheck": null,
    "checks": {
      "paymentSettled": true,
      "httpStatus": 200,
      "bodyNonEmpty": null,
      "declaredFormatMatched": null,
      "sellerReceiptValid": null,
      "responseHashMatchesSeller": null
    }
  },
  "resourceUrl": "https://ipinfo.mpp.paywithlocus.com/ipinfo/ip-lite",
  "payment": {
    "network": "eip155:4217",
    "scheme": "mpp-charge",
    "transaction": "0xc79643756df06513c452898e622dfa12629643884d509708972bbde412c1f02b",
    "payer": "0x9B59aBF3dc92E7f60A6eeB7c1dEDC6dEB0bB4E51",
    "payTo": "0x060b0fB0Be9d90557577B3AEE480711067149Ff0",
    "asset": "0x20c000000000000000000000b9537d11c60e8b50",
    "amount": "1000",
    "decimals": 6,
    "assetSymbol": "USDC.e",
    "settledAt": null
  },
  "request": {
    "method": null,
    "url_hash": "0xead5ac6f9cdf2bd73f3b58f3ae979c5dc0c9873017395a230cfc500b277d1813",
    "params_hash": null,
    "params_salted": false,
    "ts": "2026-09-28T08:04:54.471Z"
  },
  "response": {
    "status": 200,
    "responseHash": null,
    "responseHashAlg": null,
    "responseHashEncoding": null,
    "responseHashNote": "hash not recorded (this purchase predates receipts)",
    "contentType": null,
    "bytes": null,
    "receivedAt": null,
    "latencyMs": null
  },
  "offer": null,
  "sellerReceipt": null,
  "scope": {
    "proves": [
      "observer-signed-at-time",
      "payment-on-chain",
      "response-status-at-time",
      "existed-by-anchor-time"
    ],
    "doesNotProve": [
      "content-correctness",
      "seller-trustworthiness",
      "seller-availability-now",
      "refund-entitlement"
    ],
    "vantage": "Seen from vet402's network only.",
    "text": "Proves vet402 paid and what HTTP status came back at this time. Does not prove the content is correct."
  },
  "notRecorded": [
    "request.method",
    "request.ts: the time recorded is when the spend was reserved, just before the request",
    "response.contentType",
    "response.bytes (so an empty body cannot be ruled out)",
    "response.receivedAt",
    "response.latencyMs",
    "payment.settledAt",
    "request.params_hash: request body not recorded",
    "response.responseHash: hash not recorded (this purchase predates receipts)"
  ],
  "source": {
    "dataset": "tempo-ledger-2026-09-28",
    "row": "entries[22] ipinfo"
  },
  "contact": "https://vet402.com/",
  "anchor": {
    "status": "pending",
    "day": "2026-09-28",
    "network": "solana:5eykt4UsFv8P8NJdTREpY1vzqKqZKvdp",
    "tx": null,
    "root": "0xc537015303c55d6f07a1b8262914fa972b6f1cea2d472c05f8cfd1bbb92856a6",
    "leafIndex": 93,
    "proof": [
      "0x3c60b6e96536c08bfa2824fd7bba83303b1c70e021421938143a0708a4a6cbcd",
      "0x04f16224536c5a0da1d0778b1931510e65414f43109520c16c3bbaf621e58075",
      "0x632cf3ccdcd0d104e4e9630d907bc7d45fdc2c6f6268c2ef5cc4e0efb7528425",
      "0xeeade700a9201972c74230ecbe8a4c573e3d15f08d3bc851f29c8f78b19a577a",
      "0x3517a9bbeb8c4ed8e65a26818d74c618ea142f255e20b808e01dba59e9317842",
      "0x42f834e5b5780e0bceae22df5a1a5bb5cb57e0fb1646823fa91f6d3f675fe067",
      "0x0ee5f31861a3d250d6d3038facb5bf95fadd677fb7ed2e23b8b5859e5845ef95",
      "0xccc61fb963ddcdf224c536f6fb1a2f326002a746d2a935085d933bd5dab96b18"
    ],
    "count": 165,
    "sequenceRange": [
      1,
      165
    ],
    "observerAddress": "0x6232335B5264f7aa62a51f8ACc4676D22511Ff3C",
    "anchoredAt": null
  },
  "corrections": [],
  "signature": {
    "format": "eip712",
    "signature": "0x964639128353c155f778620ed31d39674bd45af309d83692a88eaa6fa0932aa135552fad2108c3013e9d6333772b3b804a07fc9ee37a5150b922114b293f3d171c"
  }
}
